Creater_name,title,thumbnail_url,videoid,video_url,like,comment_count
Krish Naik,The Future Of Coding-Code Interpreter With Chatgpt- Its Time To Make AI Your Friend,https://i.ytimg.com/vi/fbrPaKLGd1o/default.jpg,fbrPaKLGd1o,https://www.youtube.com/watch?v=fbrPaKLGd1o,446,65
Krish Naik,What Will Change In Data Science Project Development After OPENAI And Hugging Face API,https://i.ytimg.com/vi/kSr1dXRgcyw/default.jpg,kSr1dXRgcyw,https://www.youtube.com/watch?v=kSr1dXRgcyw,455,30
Krish Naik,Why You Should Learn Python In 2023 And Focus On Project Development?,https://i.ytimg.com/vi/G56dwY2CG5w/default.jpg,G56dwY2CG5w,https://www.youtube.com/watch?v=G56dwY2CG5w,389,30
Krish Naik,A Dedicated Playlist For End To End Data Science Projects Implementation With Deployment In 2023,https://i.ytimg.com/vi/qDxCYmLWUyQ/default.jpg,qDxCYmLWUyQ,https://www.youtube.com/watch?v=qDxCYmLWUyQ,609,42
Krish Naik,The Power Of Function Calling Ussing OpenAI API Tutorial #2,https://i.ytimg.com/vi/zRdzLfoTwvQ/default.jpg,zRdzLfoTwvQ,https://www.youtube.com/watch?v=zRdzLfoTwvQ,97,15
Krish Naik,OpenAI API With Python Tuorial 1-ChatCompletion API and Completion API,https://i.ytimg.com/vi/CbpsDMwFG2g/default.jpg,CbpsDMwFG2g,https://www.youtube.com/watch?v=CbpsDMwFG2g,272,23
Krish Naik,End To End Machine Learning Project Implementation Using AWS Sagemaker,https://i.ytimg.com/vi/Le-A72NjaWs/default.jpg,Le-A72NjaWs,https://www.youtube.com/watch?v=Le-A72NjaWs,533,30
Krish Naik,This Video Has Been Made By An AI With My Avatar- Future OF AI,https://i.ytimg.com/vi/PDoZb4HVM5k/default.jpg,PDoZb4HVM5k,https://www.youtube.com/watch?v=PDoZb4HVM5k,506,50
Krish Naik,Learn How Python Data Classes Can Save Your Time In Projects,https://i.ytimg.com/vi/Y9mxx1Mer0I/default.jpg,Y9mxx1Mer0I,https://www.youtube.com/watch?v=Y9mxx1Mer0I,409,26
Krish Naik,Build Python LLM apps in minutes Using Chainlit ⚡️,https://i.ytimg.com/vi/tv7rn5AsxFY/default.jpg,tv7rn5AsxFY,https://www.youtube.com/watch?v=tv7rn5AsxFY,345,20
Krish Naik,How OpenAI Will Change the Future- Sharing My Experience After Using It,https://i.ytimg.com/vi/rRlsspJObIU/default.jpg,rRlsspJObIU,https://www.youtube.com/watch?v=rRlsspJObIU,347,33
Krish Naik,Learn How To Query Pdf using Langchain Open AI in 5 min,https://i.ytimg.com/vi/5Ghv-F1wF_0/default.jpg,5Ghv-F1wF_0,https://www.youtube.com/watch?v=5Ghv-F1wF_0,276,31
Krish Naik,Prompt Engineering And LLM's With LangChain In One Shot-Generative AI,https://i.ytimg.com/vi/t2bSApmPzU4/default.jpg,t2bSApmPzU4,https://www.youtube.com/watch?v=t2bSApmPzU4,282,33
Krish Naik,Getting Started With LangChain In 20 Minutes- Build Celebrity Search Application,https://i.ytimg.com/vi/_FpT1cwcSLg/default.jpg,_FpT1cwcSLg,https://www.youtube.com/watch?v=_FpT1cwcSLg,954,61
Krish Naik,An Important Advice-AI Is Advancing Just Start Learning AI Before Its Late,https://i.ytimg.com/vi/7fPvKahR4Eg/default.jpg,7fPvKahR4Eg,https://www.youtube.com/watch?v=7fPvKahR4Eg,1192,115
Krish Naik,What Is Generative AI,https://i.ytimg.com/vi/2m7Pgl-84F8/default.jpg,2m7Pgl-84F8,https://www.youtube.com/watch?v=2m7Pgl-84F8,1110,57
Krish Naik,Machine Learning Series-Linear Regression Ordinary Least Square Method,https://i.ytimg.com/vi/KZ1mWboXE6g/default.jpg,KZ1mWboXE6g,https://www.youtube.com/watch?v=KZ1mWboXE6g,74,7
Krish Naik,"Machine Learning Series- Revising Regression Performance Metrics,MSE,MAE,RMSE, R squared-Krish Naik",https://i.ytimg.com/vi/BGlEv2CTfeg/default.jpg,BGlEv2CTfeg,https://www.youtube.com/watch?v=BGlEv2CTfeg,95,6
Krish Naik,"Machine Learning Series- Revising Complete Linear Regression,Cost Function,Convergence Algorithm",https://i.ytimg.com/vi/a22OPjS-4Lc/default.jpg,a22OPjS-4Lc,https://www.youtube.com/watch?v=a22OPjS-4Lc,244,15
Krish Naik,Complete Anomaly Detection Tutorials Machine Learning And Its Types With Implementation | Krish Naik,https://i.ytimg.com/vi/OS9xRGKfx4E/default.jpg,OS9xRGKfx4E,https://www.youtube.com/watch?v=OS9xRGKfx4E,314,19
Krish Naik,End To End Deep Learning Project Using MLOPS DVC Pipeline With Deployments Azure And AWS- Krish Naik,https://i.ytimg.com/vi/p1bfK8ZJgkE/default.jpg,p1bfK8ZJgkE,https://www.youtube.com/watch?v=p1bfK8ZJgkE,906,101
Krish Naik,Aws Activate for Startups! #shorts,https://i.ytimg.com/vi/Ixh514eMvIw/default.jpg,Ixh514eMvIw,https://www.youtube.com/watch?v=Ixh514eMvIw,438,3
Krish Naik,End To End NLP Project Implementation With Deployment Github Action- Text Summarization- Krish Naik,https://i.ytimg.com/vi/p7V4Aa7qEpw/default.jpg,p7V4Aa7qEpw,https://www.youtube.com/watch?v=p7V4Aa7qEpw,897,66
Krish Naik,"Very Good News For Startups- AWS Activate A Program to Support Startups, Founders, & Entrepreneurs",https://i.ytimg.com/vi/ZWxdQDkf_Uw/default.jpg,ZWxdQDkf_Uw,https://www.youtube.com/watch?v=ZWxdQDkf_Uw,190,10
Krish Naik,Inside ChatGPT: Unveiling the Training Process of OpenAI's Language Model,https://i.ytimg.com/vi/rcxXiLhxhsk/default.jpg,rcxXiLhxhsk,https://www.youtube.com/watch?v=rcxXiLhxhsk,461,25
Krish Naik,Is Google Bard Better Than ChatGPT? You Decide By Seeing These Major Differences,https://i.ytimg.com/vi/Ae6q7v7pOxM/default.jpg,Ae6q7v7pOxM,https://www.youtube.com/watch?v=Ae6q7v7pOxM,216,30
Krish Naik,All you Need To Know About Mojo Programming Language,https://i.ytimg.com/vi/RI2F6u9dnkU/default.jpg,RI2F6u9dnkU,https://www.youtube.com/watch?v=RI2F6u9dnkU,948,72
Krish Naik,Can ChatGPT Take A Company Down?,https://i.ytimg.com/vi/HlKpcWN3Xjg/default.jpg,HlKpcWN3Xjg,https://www.youtube.com/watch?v=HlKpcWN3Xjg,252,30
Krish Naik,This Topic Is Most Important To Learn In Linear Algebra For Machine Learning #day4,https://i.ytimg.com/vi/H5v7NG13oMc/default.jpg,H5v7NG13oMc,https://www.youtube.com/watch?v=H5v7NG13oMc,214,17
Krish Naik,Late Night Talks- Live Q&A- Lets See Who Are Awake,https://i.ytimg.com/vi/VSEk-Xye4bk/default.jpg,VSEk-Xye4bk,https://www.youtube.com/watch?v=VSEk-Xye4bk,390,8
Krish Naik,Machine Learning Series-Instance Based vs Model Based Learning#day3,https://i.ytimg.com/vi/XgWqumlu76U/default.jpg,XgWqumlu76U,https://www.youtube.com/watch?v=XgWqumlu76U,371,63
Krish Naik,Machine Learning Series- Demystifying Machine Learning Algorithms #Day2,https://i.ytimg.com/vi/DF97b5rIGgU/default.jpg,DF97b5rIGgU,https://www.youtube.com/watch?v=DF97b5rIGgU,501,63
Krish Naik,Machine Learning Series- Universe of Data Science #Day1,https://i.ytimg.com/vi/kEmnkUw0NTs/default.jpg,kEmnkUw0NTs,https://www.youtube.com/watch?v=kEmnkUw0NTs,1098,87
Krish Naik,Announcing New Fresh Machine Learning And NLP Community Sessions,https://i.ytimg.com/vi/ip4WxEZwEPc/default.jpg,ip4WxEZwEPc,https://www.youtube.com/watch?v=ip4WxEZwEPc,1424,155
Krish Naik,Live After A Long Time- Lets Talk About Updates On Data Science,https://i.ytimg.com/vi/QtdCIZeiTwA/default.jpg,QtdCIZeiTwA,https://www.youtube.com/watch?v=QtdCIZeiTwA,287,13
Krish Naik,Tutorial 12- Step By Step Production Grade Machine Learning Projects Deployment Azure Web App MLOPS,https://i.ytimg.com/vi/g687fRBNNGo/default.jpg,g687fRBNNGo,https://www.youtube.com/watch?v=g687fRBNNGo,127,19
Krish Naik,Tutorial 11- How To Deploy End To End ML Projects In Production AWS Cloud Using CI CD Pipeline,https://i.ytimg.com/vi/Xniji2m85LY/default.jpg,Xniji2m85LY,https://www.youtube.com/watch?v=Xniji2m85LY,359,37
Krish Naik,Tutorial 10- Deployment Of ML Application In Azure Cloud Using Github Actions,https://i.ytimg.com/vi/SkzmbeYCtiU/default.jpg,SkzmbeYCtiU,https://www.youtube.com/watch?v=SkzmbeYCtiU,498,34
Krish Naik,Complete Dockers For Data Science Tutorial In One Shot,https://i.ytimg.com/vi/8vmKtS8W7IQ/default.jpg,8vmKtS8W7IQ,https://www.youtube.com/watch?v=8vmKtS8W7IQ,1376,58
Krish Naik,End To End Data Science Project Implementation In One Shot- Part 1,https://i.ytimg.com/vi/1m3CPP-93RI/default.jpg,1m3CPP-93RI,https://www.youtube.com/watch?v=1m3CPP-93RI,1384,87
Krish Naik,Judging India's Largest Hackathon @physicswallah,https://i.ytimg.com/vi/6I2m7VtGLU4/default.jpg,6I2m7VtGLU4,https://www.youtube.com/watch?v=6I2m7VtGLU4,475,17
Krish Naik,Tutorial 9-End To End ML Project-Deployment In AWS Cloud Using CICD Pipelines,https://i.ytimg.com/vi/gbJn2Ls2QsI/default.jpg,gbJn2Ls2QsI,https://www.youtube.com/watch?v=gbJn2Ls2QsI,524,94
Krish Naik,Tutorial 8-End To End ML Project-Create Prediction Pipeline Using Flask Web APP,https://i.ytimg.com/vi/d6Jw5hGb65Y/default.jpg,d6Jw5hGb65Y,https://www.youtube.com/watch?v=d6Jw5hGb65Y,397,66
Krish Naik,Tutorial 7-End To End ML Project-Model Hyperparameter Tuning,https://i.ytimg.com/vi/oMZA8v4JECY/default.jpg,oMZA8v4JECY,https://www.youtube.com/watch?v=oMZA8v4JECY,282,33
Krish Naik,Tutorial 6-End To End ML Project-Model Training And Model Evaluating Component,https://i.ytimg.com/vi/EAWR1kFtEGo/default.jpg,EAWR1kFtEGo,https://www.youtube.com/watch?v=EAWR1kFtEGo,502,49
Krish Naik,Tutorial 5-End To End ML Project-Data Transformation Implementation Using Pipelines,https://i.ytimg.com/vi/Zs2BZkgoivM/default.jpg,Zs2BZkgoivM,https://www.youtube.com/watch?v=Zs2BZkgoivM,439,75
Krish Naik,Tutorial 4-End To End ML Project With Deployment- Data Ingestion Implementation Line By Line,https://i.ytimg.com/vi/_0v1UK7smBc/default.jpg,_0v1UK7smBc,https://www.youtube.com/watch?v=_0v1UK7smBc,465,96
Krish Naik,"Tutorial 3-End To End ML Project With Deployment-Project Problem Statement,EDA And Model Training",https://i.ytimg.com/vi/gqqGdu1P2FM/default.jpg,gqqGdu1P2FM,https://www.youtube.com/watch?v=gqqGdu1P2FM,1077,135
Krish Naik,"Tutorial 2- End To End ML Project With Deployment-Project Structure, Logging And Exception Handling",https://i.ytimg.com/vi/sDWL30CzJT8/default.jpg,sDWL30CzJT8,https://www.youtube.com/watch?v=sDWL30CzJT8,1126,82
Krish Naik,Inviting You To RAJASTHAN IT Online And Offline HACKATHON Powered By  @PhysicsWallah,https://i.ytimg.com/vi/dFtH8vP3WHU/default.jpg,dFtH8vP3WHU,https://www.youtube.com/watch?v=dFtH8vP3WHU,186,51
